Source,Type,Target,Relation,Domain,Range,Quantifier,Comment,Defined By,Label
OntoWasteManagement,TBox,https://www.theworldavatar.com/kg/ontowastemanagement/,https://www.w3.org/2007/05/powder-s#hasIRI,,,,,,
OntoWasteManagement,TBox,1.2,http://www.w3.org/2002/07/owl#versionInfo,,,,,,
OntoWasteManagement,TBox,"OntoWasteManagement is designed to represent and support the day-to-day waste management operations, ranging from handling collection requests and billing reports, meeting reporting requirements, to fleet and bin management.",http://www.w3.org/2000/01/rdf-schema#comment,,,,,,
OntoWasteManagement,TBox,,http://www.w3.org/2002/07/owl#imports,,,,,,
WasteService,Class,https://spec.edmcouncil.org/fibo/ontology/FND/ProductsAndServices/ProductsAndServices/Service,IS-A,,,,"A service provided by an entity (such as a municipality or private company) that involves the collection, transportation, and disposal or recycling of waste materials and equipment from residential, commercial, or industrial sources.",https://www.theworldavatar.com/kg/ontowastemanagement/,Waste service
BinDeliveryService,Class,WasteService,IS-A,,,,A service that delivers an empty bin to the specified site.,https://www.theworldavatar.com/kg/ontowastemanagement/,Bin delivery service
WasteCollectionService,Class,WasteService,IS-A,,,,"A service provided by an entity (such as a municipality or private company) that involves the collection, transportation, and disposal or recycling of waste materials from residential, commercial, or industrial sources.",https://www.theworldavatar.com/kg/ontowastemanagement/,Waste collection service
BinExchangeService,Class,WasteCollectionService,IS-A,,,,A service that delivers an empty bin to the specified site and tows away the full bin to a disposal site. The bin will not be returned to the service site afterwards.,https://www.theworldavatar.com/kg/ontowastemanagement/,Bin exchange service
TowAwayService,Class,WasteCollectionService,IS-A,,,,A service that collects the bin containing waste from the service site and disposes the waste at the disposal site. The bin will not be returned to the service site afterwards.,https://www.theworldavatar.com/kg/ontowastemanagement/,Tow away service
TouchAndGoService,Class,WasteCollectionService,IS-A,,,,A service that brings an empty bin to collect the waste from the service site and disposes the waste at the disposal site.  The bin will not be returned to the service site afterwards.,https://www.theworldavatar.com/kg/ontowastemanagement/,Touch and go service
DumpAndReturnService,Class,WasteCollectionService,IS-A,,,,"A service that collects the bin containing waste from the service site and disposes the waste at the disposal site, before returning the newly emptied bin to the service site.",https://www.theworldavatar.com/kg/ontowastemanagement/,Dump and return service
WasteDisposalService,Class,https://spec.edmcouncil.org/fibo/ontology/FND/ProductsAndServices/ProductsAndServices/Service,IS-A,,,,"A service for the management, treatment, and disposal of waste that adheres to environmental regulations and promoting sustainability.",https://www.theworldavatar.com/kg/ontowastemanagement/,Waste disposal service
WasteDisposalFacility,Class,https://www.theworldavatar.com/kg/ontobim/Facility,IS-A,,,,A facility with waste disposal services.,https://www.theworldavatar.com/kg/ontowastemanagement/,Waste disposal facility
Bin,Class,,,,,,A container used to carry and store waste.,https://www.theworldavatar.com/kg/ontowastemanagement/,Bin
OTCBin,Class,Bin,IS-A,,,,A bin capable of attaching to an OTC truck.,https://www.theworldavatar.com/kg/ontowastemanagement/,Open Top Container Bin
3ftBin,Class,OTCBin,IS-A,,,,An open top container bin with a length of 3 feet.,https://www.theworldavatar.com/kg/ontowastemanagement/,3-feet bin
5ftBin,Class,OTCBin,IS-A,,,,An open top container bin with a length of 5 feet.,https://www.theworldavatar.com/kg/ontowastemanagement/,5-feet bin
7ftBin,Class,OTCBin,IS-A,,,,An open top container bin with a length of 7 feet.,https://www.theworldavatar.com/kg/ontowastemanagement/,7-feet bin
CompactorBin,Class,OTCBin,IS-A,,,,An open top container bin with the ability to compact waste.,https://www.theworldavatar.com/kg/ontowastemanagement/,Compactor bin
HookliftTruck,Class,https://spec.edmcouncil.org/auto/ontology/VC/VehicleCore/Truck,IS-A,,,,"A versatile truck equipped with a hydraulic hooklift system, used for transporting various container types, including heavy industrial and commercial waste containers.",https://www.theworldavatar.com/kg/ontowastemanagement/,Hooklift truck
RearEndLoaderTruck,Class,https://spec.edmcouncil.org/auto/ontology/VC/VehicleCore/Truck,IS-A,,,,"A truck designed for municipal waste collection, featuring a rear-loading mechanism with a hydraulic lift to compact waste into the truck body.",https://www.theworldavatar.com/kg/ontowastemanagement/,Rear end loader truck
RecyclingTruck,Class,https://spec.edmcouncil.org/auto/ontology/VC/VehicleCore/Truck,IS-A,,,,"A truck specifically designed and equipped to collect, transport, and sometimes sort recyclable materials from various collection points to recycling facilities.",https://www.theworldavatar.com/kg/ontowastemanagement/,Recycling truck
Waste,Class,,,,,,"Any material, substance, or by-product that is no longer useful or required after the completion of a process. It is typically discarded because it is considered worthless, defective, or surplus to requirements.",https://www.theworldavatar.com/kg/ontowastemanagement/,Waste
MixedWaste,Class,Waste,IS-A,,,,"Waste that contains a combination of different materials, that may or may not be difficult to identify and separate individual components.",https://www.theworldavatar.com/kg/ontowastemanagement/,Mixed waste
AshWaste,Class,Waste,IS-A,,,,"The residual byproduct generated from the incineration of various materials, including municipal solid waste, hazardous waste, and industrial byproducts.   Ash waste typically contains concentrated trace metals and other inorganic compounds.",https://www.theworldavatar.com/kg/ontowastemanagement/,Ash waste
SludgeWaste,Class,Waste,IS-A,,,,"A semi-solid slurry that accumulates as a byproduct of wastewater treatment processes. It consists of organic and inorganic materials, including water, microorganisms, and chemical residues.",https://www.theworldavatar.com/kg/ontowastemanagement/,Sludge waste
ConstructionDemolitionWaste,Class,Waste,IS-A,,,,"Waste generated from the construction, renovation, and demolition of buildings, roads, and other structures.",https://www.theworldavatar.com/kg/ontowastemanagement/,Construction and demolition waste
ElectronicWaste,Class,Waste,IS-A,,,,"Discarded electrical or electronic devices, such as computers, mobile phones, household appliances, and medical equipment. E-waste can contain hazardous materials like lead and mercury.",https://www.theworldavatar.com/kg/ontowastemanagement/,Electronic waste
FerrousMetalWaste,Class,Waste,IS-A,,,,"Waste composed of iron and steel. These metals are magnetic and are commonly found in items like appliances, cars, and construction materials.",https://www.theworldavatar.com/kg/ontowastemanagement/,Ferrous metal waste
FoodWaste,Class,Waste,IS-A,,,,"Edible food that is discarded at the retail or consumption stages, often due to spoilage or overproduction.",https://www.theworldavatar.com/kg/ontowastemanagement/,Food waste
FishWaste,Class,FoodWaste,IS-A,,,,"Organic materials resulting from fish cleaning or processing, including flesh, skin, bones, and entrails.",https://www.theworldavatar.com/kg/ontowastemanagement/,Fish waste
VegetableWaste,Class,FoodWaste,IS-A,,,,"Waste comprised mainly of vegetable matter, which is capable of being decomposed by microorganisms.",https://www.theworldavatar.com/kg/ontowastemanagement/,Vegetable waste
GlassWaste,Class,Waste,IS-A,,,,"Discarded glass products, such as bottles and jars, which can be recycled into new glass products.",https://www.theworldavatar.com/kg/ontowastemanagement/,Glass waste
HorticulturalWaste,Class,Waste,IS-A,,,,"Waste generated in orchards, parks, gardens, and roadside plants, including green foliage, branches, and leaves.",https://www.theworldavatar.com/kg/ontowastemanagement/,Horticultural waste
TreeTrunkWaste,Class,HorticulturalWaste,IS-A,,,,"The large, central part of a tree that is cut down and discarded during tree removal or logging activities.",https://www.theworldavatar.com/kg/ontowastemanagement/,Tree trunk waste
TreeBranchesWaste,Class,HorticulturalWaste,IS-A,,,,Smaller limbs and twigs removed from trees during pruning or tree removal. ,https://www.theworldavatar.com/kg/ontowastemanagement/,Tree branches waste
LeavesWaste,Class,HorticulturalWaste,IS-A,,,,"Waste consisting of fallen leaves from trees and plants, often collected during seasonal cleanups.",https://www.theworldavatar.com/kg/ontowastemanagement/,Leaves waste
NonFerrousMetalWaste,Class,Waste,IS-A,,,,"Waste composed of metals that do not contain iron, such as aluminum, copper, and brass. These metals are not magnetic.",https://www.theworldavatar.com/kg/ontowastemanagement/,Non-ferrous metal waste
AluminiumWaste,Class,NonFerrousMetalWaste,IS-A,,,,"Waste consisting of aluminum products, such as cans, foil, and packaging materials.",https://www.theworldavatar.com/kg/ontowastemanagement/,Aluminium waste
StainlessSteelWaste,Class,NonFerrousMetalWaste,IS-A,,,,"Waste composed of stainless steel, which is an alloy of iron, chromium, and other elements, known for its corrosion resistance.",https://www.theworldavatar.com/kg/ontowastemanagement/,Stainless steel waste
CopperWaste,Class,NonFerrousMetalWaste,IS-A,,,,"Waste consisting of copper products, such as wiring, plumbing pipes, and electronics components.",https://www.theworldavatar.com/kg/ontowastemanagement/,Copper waste
PaperCardboardWaste,Class,Waste,IS-A,,,,"Waste consisting of paper and cardboard materials, including office paper, newspapers, and packaging.",https://www.theworldavatar.com/kg/ontowastemanagement/,Paper or cardboard waste
PaperWaste,Class,PaperCardboardWaste,IS-A,,,,"Waste composed of paper products, such as office paper, newspapers, and magazines.",https://www.theworldavatar.com/kg/ontowastemanagement/,Paper waste
OldCorrugatedCardboardWaste,Class,PaperCardboardWaste,IS-A,,,,"Waste consisting of used corrugated cardboard, often from packaging and shipping materials.",https://www.theworldavatar.com/kg/ontowastemanagement/,Old corrugated cardboard waste
PlasticsWaste,Class,Waste,IS-A,,,,"Waste composed of plastic materials, including bottles, packaging, and containers.",https://www.theworldavatar.com/kg/ontowastemanagement/,Plastics waste
PolyethyleneTerephthalateWaste,Class,PlasticsWaste,IS-A,,,,"Waste composed of polyethylene terephthalate materials, including beverage bottles and food containers. ",https://www.theworldavatar.com/kg/ontowastemanagement/,Polyethylene terephthalate (PET) waste
HighDensityPolyethyleneWaste,Class,PlasticsWaste,IS-A,,,,"Waste composed of high-density polyethylene materials, including milk jugs, detergent bottles, and piping. ",https://www.theworldavatar.com/kg/ontowastemanagement/,High-density polyethylene (HDPE) waste
LowDensityPolyethyleneWaste,Class,PlasticsWaste,IS-A,,,,"Waste composed of low-density polyethylene materials, including plastic bags, film wraps, and squeeze bottles.",https://www.theworldavatar.com/kg/ontowastemanagement/,Low-density polyethylene (LDPE) waste
PolypropyleneWaste,Class,PlasticsWaste,IS-A,,,,"Waste composed of polypropylene materials, including packaging, automotive parts, and textiles.",https://www.theworldavatar.com/kg/ontowastemanagement/,Polypropylene (PP) waste
PolystyreneWaste,Class,PlasticsWaste,IS-A,,,,"Waste composed of polystyrene materials, including disposable food containers, packaging materials, and insulation.",https://www.theworldavatar.com/kg/ontowastemanagement/,Polystyrene (PS) waste
ScrapTyresWaste,Class,Waste,IS-A,,,,Waste consisting of used and discarded tires from vehicles.,https://www.theworldavatar.com/kg/ontowastemanagement/,Scrap tyres waste
TextileLeatherWaste,Class,Waste,IS-A,,,,"Waste composed of textile and leather materials, including clothing, upholstery, and footwear.",https://www.theworldavatar.com/kg/ontowastemanagement/,Textile or leather waste
UsedSlagWaste,Class,Waste,IS-A,,,,"Waste produced from the smelting and refining of metals, consisting of byproducts like slag.",https://www.theworldavatar.com/kg/ontowastemanagement/,Used slag waste
WoodWaste,Class,Waste,IS-A,,,,"Waste consisting of wood materials, including lumber, pallets, and furniture.",https://www.theworldavatar.com/kg/ontowastemanagement/,Wood waste
PalletWaste,Class,WoodWaste,IS-A,,,,Waste composed of wooden pallets used for shipping and storage.,https://www.theworldavatar.com/kg/ontowastemanagement/,Pallet waste
FurnitureWaste,Class,WoodWaste,IS-A,,,,"Waste consisting of discarded furniture items, such as chairs, tables, and sofas.",https://www.theworldavatar.com/kg/ontowastemanagement/,Furniture waste
GrossTruckWeight,Class,https://www.omg.org/spec/Commons/QuantitiesAndUnits/ScalarQuantityValue,IS-A,,,,Weight of a truck and its waste before any disposal.,https://www.theworldavatar.com/kg/ontowastemanagement/,Gross truck weight
UnladenTruckWeight,Class,https://www.omg.org/spec/Commons/QuantitiesAndUnits/ScalarQuantityValue,IS-A,,,,Weight of an empty truck after waste disposal.,https://www.theworldavatar.com/kg/ontowastemanagement/,Unladen truck weight
NetWasteWeight,Class,https://www.omg.org/spec/Commons/QuantitiesAndUnits/ScalarQuantityValue,IS-A,,,,"Weight of the waste disposed, which is calculated through the difference of gross and unladen weight.",https://www.theworldavatar.com/kg/ontowastemanagement/,Net waste weight
BinStatus,Class,,,,,,The current state of a bin. ,https://www.theworldavatar.com/kg/ontowastemanagement/,Bin status
hasBinType,Object Property,,,WasteService,http://www.w3.org/2002/07/owl#Class,minimum 1,A relationship describing the bin type for a series of waste services.,https://www.theworldavatar.com/kg/ontowastemanagement/,has bin type
hasWasteType,Object Property,,,WasteCollectionService,http://www.w3.org/2002/07/owl#Class,minimum 1,A relationship describing the waste category for a series of waste services.,https://www.theworldavatar.com/kg/ontowastemanagement/,has waste type
hasStatus,Object Property,,,Bin,BinStatus,,A relationship describing the current bin status.,https://www.theworldavatar.com/kg/ontowastemanagement/,has status
hasBinNumber,Data Property,,,Bin,string,exactly 1,An identifier for a bin.,https://www.theworldavatar.com/kg/ontowastemanagement/,has bin number
isRecyclable,Data Property,,,Waste,boolean,,A property indicating if the waste is recyclable or not.,https://www.theworldavatar.com/kg/ontowastemanagement/,is recyclable
