Source,Type,Target,Relation,Domain,Range,Quantifier,Comment,Defined By,Label
OntoBuiltEnv,TBox,http://www.theworldavatar.com/ontology/ontobuiltenv/OntoBuiltEnv.owl,https://www.w3.org/2007/05/powder-s#hasIRI,,,,,,
OntoBuiltEnv,TBox,1,http://www.w3.org/2002/07/owl#versionInfo,,,,,,
OntoBuiltEnv,TBox,"The Building Environment ontology (OntoBuiltEnv) is an ontology developed for representing key information about buildings. It combines information about building usage, key construction characteristics, location and address, and estimated property value. More detailed geometric information can be retrieved from the associated OntoCityGml representation.",http://www.w3.org/2000/01/rdf-schema#comment,,,,,,
OntoBuiltEnv,TBox,,http://www.w3.org/2002/07/owl#imports,,,,,,
http://www.purl.org/oema/infrastructure/Building,Class,http://ontology.eil.utoronto.ca/icity/Building/Building,EQUIVALENT-TO,,,,"A built structure with ground, roof, and walls which stands more or less permanently in one place.",http://www.theworldavatar.com/ontology/ontobuiltenv/OntoBuiltEnv.owl,
http://www.purl.org/oema/infrastructure/Building,Class,https://w3id.org/bot#Building,EQUIVALENT-TO,,,,,http://www.theworldavatar.com/ontology/ontobuiltenv/OntoBuiltEnv.owl,
http://www.purl.org/oema/infrastructure/Building,Class,https://standards.buildingsmart.org/IFC/DEV/IFC4/ADD2_TC1/OWL#IfcBuilding,EQUIVALENT-TO,,,,,http://www.theworldavatar.com/ontology/ontobuiltenv/OntoBuiltEnv.owl,
http://www.purl.org/oema/infrastructure/Building,Class,http://www.google.com/digitalbuildings/0.0.1/facilities#Building,EQUIVALENT-TO,,,,,http://www.theworldavatar.com/ontology/ontobuiltenv/OntoBuiltEnv.owl,
http://www.purl.org/oema/infrastructure/Building,Class,http://bimerr.iot.linkeddata.es/def/building#Building,EQUIVALENT-TO,,,,,http://www.theworldavatar.com/ontology/ontobuiltenv/OntoBuiltEnv.owl,
hasIdentifier,Data Property,,,http://www.purl.org/oema/infrastructure/Building,string,exactly 1,Unique identifier describing the building.,http://www.theworldavatar.com/ontology/ontobuiltenv/OntoBuiltEnv.owl,
hasWGS84LatitudeLongitude,Data Property,,,http://www.purl.org/oema/infrastructure/Building,http://www.bigdata.com/rdf/geospatial/literals/v1#lat-lon,exactly 1,Location of building footprint centroid in WGS84 coordinates.,http://www.theworldavatar.com/ontology/ontobuiltenv/OntoBuiltEnv.owl,
AdministrativeDistrict,Class,,,,,,"An area defined for administrative purposes, e.g. a county or postal code district.",http://www.theworldavatar.com/ontology/ontobuiltenv/OntoBuiltEnv.owl,
hasAddress,Object Property,,,http://www.purl.org/oema/infrastructure/Building,http://ontology.eil.utoronto.ca/icontact.owl#Address,exactly 1,A relationship between a building and its address.,http://www.theworldavatar.com/ontology/ontobuiltenv/OntoBuiltEnv.owl,
hasAdministrativeDistrict,Object Property,,,http://ontology.eil.utoronto.ca/icontact.owl#Address,AdministrativeDistrict,,A relationship between an address and an encompassing administrative district.,http://www.theworldavatar.com/ontology/ontobuiltenv/OntoBuiltEnv.owl,
http://ontology.eil.utoronto.ca/icontact.owl#hasPostalCode,Data Property,,,http://ontology.eil.utoronto.ca/icontact.owl#Address,string,exactly 1,A relationship between an address and the respective postal code.,http://ontology.eil.utoronto.ca/icontact.owl,
http://ontology.eil.utoronto.ca/icontact.owl#hasStreet,Data Property,,,http://ontology.eil.utoronto.ca/icontact.owl#Address,string,exactly 1,A relationship between an address and the respective street name.,http://ontology.eil.utoronto.ca/icontact.owl,
hasPropertyNumber,Data Property,,,http://ontology.eil.utoronto.ca/icontact.owl#Address,string,exactly 1,A relationship between an address and the respective property number (e.g. house and/or unit number),http://www.theworldavatar.com/ontology/ontobuiltenv/OntoBuiltEnv.owl,
locatedIn,Object Property,,,http://www.purl.org/oema/infrastructure/Building,AdministrativeDistrict,,A relationship between a building and an encompassing administrative district.,http://www.theworldavatar.com/ontology/ontobuiltenv/OntoBuiltEnv.owl,
hasOntoCityGMLRepresentation,Data Property,,,http://www.purl.org/oema/infrastructure/Building,string,,A relationship between a building and its corresponding instance IRI in OntoCityGml.,http://www.theworldavatar.com/ontology/ontobuiltenv/OntoBuiltEnv.owl,
hasTotalFloorArea,Object Property,,,http://www.purl.org/oema/infrastructure/Building,http://www.ontology-of-units-of-measure.org/resource/om-2/Area,exactly 1,A relationship between a building and its total floor area.,http://www.theworldavatar.com/ontology/ontobuiltenv/OntoBuiltEnv.owl,
hasInstalledPVArea,Object Property,,,http://www.purl.org/oema/infrastructure/Building,http://www.ontology-of-units-of-measure.org/resource/om-2/Area,exactly 1,A relationship between a building and its total installed photovoltaics area.,http://www.theworldavatar.com/ontology/ontobuiltenv/OntoBuiltEnv.owl,
hasGroundElevation,Object Property,,,http://www.purl.org/oema/infrastructure/Building,http://www.ontology-of-units-of-measure.org/resource/om-2/Height,exactly 1,A relationship between a building and its ground elevation.,http://www.theworldavatar.com/ontology/ontobuiltenv/OntoBuiltEnv.owl,
hasMarketValue,Object Property,,,http://www.purl.org/oema/infrastructure/Building,http://www.ontology-of-units-of-measure.org/resource/om-2/AmountOfMoney,exactly 1,A relationship between a building and its (estimated) property value.,http://www.theworldavatar.com/ontology/ontobuiltenv/OntoBuiltEnv.owl,
http://www.ontology-of-units-of-measure.org/resource/om-2/hasValue,Object Property,,,http://www.ontology-of-units-of-measure.org/resource/om-2/Area UNION http://www.ontology-of-units-of-measure.org/resource/om-2/Height UNION http://www.ontology-of-units-of-measure.org/resource/om-2/AmountOfMoney,http://www.ontology-of-units-of-measure.org/resource/om-2/Measure,,,http://www.ontology-of-units-of-measure.org/resource/om-2/,
http://www.ontology-of-units-of-measure.org/resource/om-2/hasNumericalValue,Data Property,,,http://www.ontology-of-units-of-measure.org/resource/om-2/Measure,float,,,http://www.ontology-of-units-of-measure.org/resource/om-2/,
http://www.ontology-of-units-of-measure.org/resource/om-2/hasUnit,Object Property,,,http://www.ontology-of-units-of-measure.org/resource/om-2/Measure,http://www.ontology-of-units-of-measure.org/resource/om-2/Unit,,,http://www.ontology-of-units-of-measure.org/resource/om-2/,
http://www.ontology-of-units-of-measure.org/resource/om-2/symbol,Data Property,,,http://www.ontology-of-units-of-measure.org/resource/om-2/Unit,string,,,http://www.ontology-of-units-of-measure.org/resource/om-2/,
ConstructionComponent,Class,,,,,,"Key construction component of a building (i.e. wall, floor, roof, window).",http://www.theworldavatar.com/ontology/ontobuiltenv/OntoBuiltEnv.owl,
hasConstructionComponent,Object Property,,,http://www.purl.org/oema/infrastructure/Building,ConstructionComponent,,A relationship between a building and one of its key construction components.,http://www.theworldavatar.com/ontology/ontobuiltenv/OntoBuiltEnv.owl,
Wall,Class,ConstructionComponent,IS-A,,,,Key construction characteristics of the building's walls.,http://www.theworldavatar.com/ontology/ontobuiltenv/OntoBuiltEnv.owl,
Roof,Class,ConstructionComponent,IS-A,,,,Key construction characteristics of the building's roof.,http://www.theworldavatar.com/ontology/ontobuiltenv/OntoBuiltEnv.owl,
Window,Class,ConstructionComponent,IS-A,,,,Key construction characteristics of the building's windows.,http://www.theworldavatar.com/ontology/ontobuiltenv/OntoBuiltEnv.owl,
Floor,Class,ConstructionComponent,IS-A,,,,Key construction characteristics of the building's floor.,http://www.theworldavatar.com/ontology/ontobuiltenv/OntoBuiltEnv.owl,
hasConstructionDate,Object Property,,,http://www.purl.org/oema/infrastructure/Building,https://www.w3.org/2006/time#Interval,,A relationship between a building and its construction dates.,http://www.theworldavatar.com/ontology/ontobuiltenv/OntoBuiltEnv.owl,
https://www.w3.org/2006/time#hasBeginning,Object Property,,,https://www.w3.org/2006/time#Interval,https://www.w3.org/2006/time#Instant,,,https://www.w3.org/2006/time,
https://www.w3.org/2006/time#hasEnd,Object Property,,,https://www.w3.org/2006/time#Interval,https://www.w3.org/2006/time#Instant,,,https://www.w3.org/2006/time,
https://www.w3.org/2006/time#inXSDDateTimeStamp,Data Property,,,https://www.w3.org/2006/time#Instant,dateTimeStamp,,,https://www.w3.org/2006/time,
hasEnergyRating,Data Property,,,http://www.purl.org/oema/infrastructure/Building,string,,A relationship between a building and its overall energy efficiency rating (e.g. linear 'A to G' rating (where A is the most energy efficient and G is the least energy efficient)),http://www.theworldavatar.com/ontology/ontobuiltenv/OntoBuiltEnv.owl,
hasNumberOfHabitableRooms,Data Property,,,http://www.purl.org/oema/infrastructure/Building,integer,,A relationship between a building and its total number of habitable rooms.,http://www.theworldavatar.com/ontology/ontobuiltenv/OntoBuiltEnv.owl,
BuiltForm,Class,,,,,,The built form of the property.,http://www.theworldavatar.com/ontology/ontobuiltenv/OntoBuiltEnv.owl,
hasBuiltForm,Object Property,,,http://www.purl.org/oema/infrastructure/Building,BuiltForm,exactly 1,,http://www.theworldavatar.com/ontology/ontobuiltenv/OntoBuiltEnv.owl,
Detached,Class,BuiltForm,IS-A,,,,A property with a detached built form.,http://www.theworldavatar.com/ontology/ontobuiltenv/OntoBuiltEnv.owl,
Semi-Detached,Class,BuiltForm,IS-A,,,,A property with a semi-detached built form.,http://www.theworldavatar.com/ontology/ontobuiltenv/OntoBuiltEnv.owl,
Terraced,Class,BuiltForm,IS-A,,,,A property with a terraced built form.,http://www.theworldavatar.com/ontology/ontobuiltenv/OntoBuiltEnv.owl,
PropertyType,Class,,,,,,The general type of the property.,http://www.theworldavatar.com/ontology/ontobuiltenv/OntoBuiltEnv.owl,
hasPropertyType,Object Property,,,http://www.purl.org/oema/infrastructure/Building,PropertyType,exactly 1,,http://www.theworldavatar.com/ontology/ontobuiltenv/OntoBuiltEnv.owl,
House,Class,PropertyType,IS-A,,,,"A dwelling that serves as living quarters for one or more families, with one or more storeys.",http://www.theworldavatar.com/ontology/ontobuiltenv/OntoBuiltEnv.owl,
Bungalow,Class,PropertyType,IS-A,,,,A small house with a single story.,http://www.theworldavatar.com/ontology/ontobuiltenv/OntoBuiltEnv.owl,
ParkHome,Class,PropertyType,IS-A,,,,Typically offsite manufactured bungalow-style homes that are located within a private estate.,http://www.theworldavatar.com/ontology/ontobuiltenv/OntoBuiltEnv.owl,
Maisonette,Class,PropertyType,IS-A,,,,A self-contained apartment (usually on two floors) in a larger building and with its own entrance from the outside.,http://www.theworldavatar.com/ontology/ontobuiltenv/OntoBuiltEnv.owl,
BuildingUsageCategory,Class,,,,,,Description of the (intended) usage and/or function of a building.,http://www.theworldavatar.com/ontology/ontobuiltenv/OntoBuiltEnv.owl,
hasUsageCategory,Object Property,,,http://www.purl.org/oema/infrastructure/Building,BuildingUsageCategory,,,http://www.theworldavatar.com/ontology/ontobuiltenv/OntoBuiltEnv.owl,
Domestic,Class,BuildingUsageCategory,IS-A,,,,A building that serves as living space for one or more parties.,http://www.theworldavatar.com/ontology/ontobuiltenv/OntoBuiltEnv.owl,
Non-Domestic,Class,BuildingUsageCategory,IS-A,,,,"A building that serves non-living purposes (i.e. commercial, industrial, public buildings).",http://www.theworldavatar.com/ontology/ontobuiltenv/OntoBuiltEnv.owl,
SingleResidential,Class,Domestic,IS-A,,,,A building that serves as living space for one party.,http://www.theworldavatar.com/ontology/ontobuiltenv/OntoBuiltEnv.owl,
MultiResidential,Class,Domestic,IS-A,,,,A building that serves as living space for more than one party.,http://www.theworldavatar.com/ontology/ontobuiltenv/OntoBuiltEnv.owl,
EmergencyService,Class,Non-Domestic,IS-A,,,,Emergency services are organizations which ensure public safety and health by addressing different emergencies.,http://www.theworldavatar.com/ontology/ontobuiltenv/OntoBuiltEnv.owl,
MedicalCare,Class,Non-Domestic,IS-A,,,,Medical care includes sites which focus on the provision of secondary medical care services.,http://www.theworldavatar.com/ontology/ontobuiltenv/OntoBuiltEnv.owl,
Education,Class,Non-Domestic,IS-A,,,,Education includes a very broad group of sites with a common high level primary function of providing education (either state funded or by fees).,http://www.theworldavatar.com/ontology/ontobuiltenv/OntoBuiltEnv.owl,
Office,Class,Non-Domestic,IS-A,,,,A place of business where professional or clerical duties are performed.,http://www.theworldavatar.com/ontology/ontobuiltenv/OntoBuiltEnv.owl,
RetailEstablishment,Class,Non-Domestic,IS-A,,,,A feature that sells to the general public finished goods.,http://www.theworldavatar.com/ontology/ontobuiltenv/OntoBuiltEnv.owl,
ReligiousFacility,Class,Non-Domestic,IS-A,,,,A place where members of a religious group congregate for worship.,http://www.theworldavatar.com/ontology/ontobuiltenv/OntoBuiltEnv.owl,
IndustrialFacility,Class,Non-Domestic,IS-A,,,,A building used for industrial fabrication or processing of goods. ,http://www.theworldavatar.com/ontology/ontobuiltenv/OntoBuiltEnv.owl,
EatingEstablishment,Class,Non-Domestic,IS-A,,,,A business whose primary function is the serving of food for consumption on the premises.,http://www.theworldavatar.com/ontology/ontobuiltenv/OntoBuiltEnv.owl,
DrinkingEstablishment,Class,Non-Domestic,IS-A,,,,A business whose primary function is the serving of alcoholic beverages for consumption on the premises.,http://www.theworldavatar.com/ontology/ontobuiltenv/OntoBuiltEnv.owl,
Hotel,Class,Non-Domestic,IS-A,,,,A building where travelers can pay for lodging and meals and other services.,http://www.theworldavatar.com/ontology/ontobuiltenv/OntoBuiltEnv.owl,
SportsFacility,Class,Non-Domestic,IS-A,,,,A feature where one or many different sports can be played.,http://www.theworldavatar.com/ontology/ontobuiltenv/OntoBuiltEnv.owl,
CulturalFacility,Class,Non-Domestic,IS-A,,,,A feature that is deemed to be of particular interest to society.,http://www.theworldavatar.com/ontology/ontobuiltenv/OntoBuiltEnv.owl,
TransportFacility,Class,Non-Domestic,IS-A,,,,A feature that is associated with the movement of passengers and goods.,http://www.theworldavatar.com/ontology/ontobuiltenv/OntoBuiltEnv.owl,
FireStation,Class,EmergencyService,IS-A,,,,"A facility which may house fire fighters, and contains the equipment and vehicles.",http://www.theworldavatar.com/ontology/ontobuiltenv/OntoBuiltEnv.owl,
PoliceStation,Class,EmergencyService,IS-A,,,,The local office of a police force in a particular area.,http://www.theworldavatar.com/ontology/ontobuiltenv/OntoBuiltEnv.owl,
Hospital,Class,MedicalCare,IS-A,,,,A medical facility that provides second level care.,http://www.theworldavatar.com/ontology/ontobuiltenv/OntoBuiltEnv.owl,
Clinic,Class,MedicalCare,IS-A,,,,A medical facility for outpatient primary level healthcare.,http://www.theworldavatar.com/ontology/ontobuiltenv/OntoBuiltEnv.owl,
School,Class,Education,IS-A,,,,A building where young people receive primary and secondary education.,http://www.theworldavatar.com/ontology/ontobuiltenv/OntoBuiltEnv.owl,
University,Class,Education,IS-A,,,,A site providing higher/university education.,http://www.theworldavatar.com/ontology/ontobuiltenv/OntoBuiltEnv.owl,
hasIdentifier,Data Property,,,http://www.purl.org/oema/infrastructure/Building,string,,,http://www.theworldavatar.com/ontology/ontobuiltenv/OntoBuiltEnv.owl,
hasWGS84LatitudeLongitude,Data Property,,,http://www.purl.org/oema/infrastructure/Building,http://www.bigdata.com/rdf/geospatial/literals/v1#lat-lon,,,http://www.theworldavatar.com/ontology/ontobuiltenv/OntoBuiltEnv.owl,
hasAddress,Object Property,,,http://www.purl.org/oema/infrastructure/Building,http://ontology.eil.utoronto.ca/icontact.owl#Address,,,http://www.theworldavatar.com/ontology/ontobuiltenv/OntoBuiltEnv.owl,
http://ontology.eil.utoronto.ca/icontact.owl#hasPostalCode,Data Property,,,http://ontology.eil.utoronto.ca/icontact.owl#Address,string,,,http://ontology.eil.utoronto.ca/icontact.owl,
http://ontology.eil.utoronto.ca/icontact.owl#hasStreet,Data Property,,,http://ontology.eil.utoronto.ca/icontact.owl#Address,string,,,http://ontology.eil.utoronto.ca/icontact.owl,
hasPropertyNumber,Data Property,,,http://ontology.eil.utoronto.ca/icontact.owl#Address,string,,,http://www.theworldavatar.com/ontology/ontobuiltenv/OntoBuiltEnv.owl,
hasTotalFloorArea,Object Property,,,http://www.purl.org/oema/infrastructure/Building,http://www.ontology-of-units-of-measure.org/resource/om-2/Area,,,http://www.theworldavatar.com/ontology/ontobuiltenv/OntoBuiltEnv.owl,
hasInstalledPVArea,Object Property,,,http://www.purl.org/oema/infrastructure/Building,http://www.ontology-of-units-of-measure.org/resource/om-2/Area,,,http://www.theworldavatar.com/ontology/ontobuiltenv/OntoBuiltEnv.owl,
hasGroundElevation,Object Property,,,http://www.purl.org/oema/infrastructure/Building,http://www.ontology-of-units-of-measure.org/resource/om-2/Height,,,http://www.theworldavatar.com/ontology/ontobuiltenv/OntoBuiltEnv.owl,
hasMarketValue,Object Property,,,http://www.purl.org/oema/infrastructure/Building,http://www.ontology-of-units-of-measure.org/resource/om-2/AmountOfMoney,,,http://www.theworldavatar.com/ontology/ontobuiltenv/OntoBuiltEnv.owl,
hasBuiltForm,Object Property,,,http://www.purl.org/oema/infrastructure/Building,BuiltForm,,,http://www.theworldavatar.com/ontology/ontobuiltenv/OntoBuiltEnv.owl,
hasPropertyType,Object Property,,,http://www.purl.org/oema/infrastructure/Building,PropertyType,,,http://www.theworldavatar.com/ontology/ontobuiltenv/OntoBuiltEnv.owl,
