Source,Type,Target,Relation,Domain,Range,Quantifier,Comment,Defined By,Label
OntoVapourtec,TBox,https://www.theworldavatar.com/kg/ontovapourtec/,https://www.w3.org/2007/05/powder-s#hasIRI,,,,,,
OntoVapourtec,TBox,1.7,http://www.w3.org/2002/07/owl#versionInfo,,,,,,
OntoVapourtec,TBox,OntoVapourtec is an ontology developed for expressing a Vapourtec experiment module.,http://www.w3.org/2000/01/rdf-schema#comment,,,,,,
OntoVapourtec,TBox,,http://www.w3.org/2002/07/owl#imports,,,,,,
VapourtecRS400,Class,https://www.theworldavatar.com/kg/ontolab/LabEquipment,IS-A,,,,"The RS-400 is a complex system, with some room for customisation. It is still completely modular, compatible with simpler and older systems. It includes fully automated control, an autosampler/collector, 4 pumps and a number of reactors. It is ideal for library synthesis and catalysis screening. [https://www.vapourtec.com/products/r-series-flow-chemistry-system/reactions-and-reagents-automated-rs-400-features/]",https://www.theworldavatar.com/kg/ontovapourtec/,
VapourtecR4Reactor,Class,https://www.theworldavatar.com/kg/ontolab/LabEquipment,IS-A,,,,"The RS-400 comes with a standard heated, cooled and high temperature tube reactors and the standard heated column reactor. [https://www.vapourtec.com/products/r-series-flow-chemistry-system/reactions-and-reagents-automated-rs-400-features/]",https://www.theworldavatar.com/kg/ontovapourtec/,
VapourtecR2Pump,Class,https://www.theworldavatar.com/kg/ontolab/LabEquipment,IS-A,,,,The RS-400 comes with four R2-C (acid resistant pump) pumps as standard. [https://www.vapourtec.com/products/r-series-flow-chemistry-system/reactions-and-reagents-automated-rs-400-features/],https://www.theworldavatar.com/kg/ontovapourtec/,
AutoSampler,Class,https://www.theworldavatar.com/kg/ontolab/LabEquipment,IS-A,,,,The autosampler is the facility for the reagents to be preloaded into �Sample Injection Loops� and then released into the flow at the correct moment as required (all controlled by the R-Series software if required). [https://www.vapourtec.com/products/r-series-expansion/automation-analysis-automated-reagent-addition/],https://www.theworldavatar.com/kg/ontovapourtec/,
AutoSamplerSite,Class,,,,,,The site on the rack of autosampler that holds vials for chemical amount.,https://www.theworldavatar.com/kg/ontovapourtec/,
ReactorSettings,Class,https://www.theworldavatar.com/kg/ontolab/EquipmentSettings,IS-A,,,,Equipment setting that specifies the reactor operating conditions.,https://www.theworldavatar.com/kg/ontovapourtec/,
PumpSettings,Class,https://www.theworldavatar.com/kg/ontolab/EquipmentSettings,IS-A,,,,Equipment setting that specifies the pump operating conditions.,https://www.theworldavatar.com/kg/ontovapourtec/,
ReactorTemperatureSetting,Class,https://www.theworldavatar.com/kg/ontolab/TemperatureSetting,IS-A,,,,Setting that specifies the reactor temperature.,https://www.theworldavatar.com/kg/ontovapourtec/,
ResidenceTimeSetting,Class,https://www.theworldavatar.com/kg/ontolab/DurationSetting,IS-A,,,,Setting that specifies the reaction residence time.,https://www.theworldavatar.com/kg/ontovapourtec/,
SampleLoopVolumeSetting,Class,https://www.theworldavatar.com/kg/ontolab/VolumeSetting,IS-A,,,,Setting that specifies the sample loop volume.,https://www.theworldavatar.com/kg/ontovapourtec/,
StoichiometryRatioSetting,Class,https://www.theworldavatar.com/kg/ontolab/ParameterSetting,IS-A,,,,Setting that specifies the stoichiometry ratio of the inlet streams from the inlet pumps to the reactor.,https://www.theworldavatar.com/kg/ontovapourtec/,
FlowChemistry,Class,https://saref.etsi.org/core/Task,IS-A,,,,Flow chemistry refers to the chemical reactions that run in a continuous stream. Here the flow chemistry is modelled as a saref:Task that can be accomplished by the Vapourtec module.,https://www.theworldavatar.com/kg/ontovapourtec/,
FlowCommander,Class,https://saref.etsi.org/core/Service,IS-A,,,,"FlowCommander (R-Series software) is a PC or touchpanel based application that allows the automation and datalogging of Vapourtec R-Series modules. The R-Series software can also control other devices such as UV detectors, fraction collectors, liquid handlers and standalone pumps. [https://www.vapourtec.com/products/r-series-software/]",https://www.theworldavatar.com/kg/ontovapourtec/,
VapourtecFunction,Class,https://saref.etsi.org/core/Function,IS-A,,,,"The functions provided by the Vapourtec modules, most of which are interfaced via FlowCommander.",https://www.theworldavatar.com/kg/ontovapourtec/,
VapourtecState,Class,https://saref.etsi.org/core/State,IS-A,,,,The possible states of Vapourtec module during its execution.,https://www.theworldavatar.com/kg/ontovapourtec/,
Launch,Class,VapourtecFunction,IS-A,,,,The function to launch the FlowCommander.,https://www.theworldavatar.com/kg/ontovapourtec/,
Connection,Class,VapourtecFunction,IS-A,,,,The function to establish the connection between FlowCommander and the physical existence of Vapourtec module.,https://www.theworldavatar.com/kg/ontovapourtec/,
RunReactor,Class,VapourtecFunction,IS-A,,,,The function to run the reactor.,https://www.theworldavatar.com/kg/ontovapourtec/,
CleanReactor,Class,VapourtecFunction,IS-A,,,,The function to clean the reactor.,https://www.theworldavatar.com/kg/ontovapourtec/,
GetState,Class,VapourtecFunction,IS-A,,,,The function to retrieve the state of Vapourtec module.,https://www.theworldavatar.com/kg/ontovapourtec/,
FaultRecovery,Class,VapourtecFunction,IS-A,,,,The function to recover Vapourtec module from fault.,https://www.theworldavatar.com/kg/ontovapourtec/,
StartFlowCommander,Class,https://saref.etsi.org/core/Command,IS-A,,,,"The command to realise the ""Launch"" function.",https://www.theworldavatar.com/kg/ontovapourtec/,
ConnectToFlowCommander,Class,https://saref.etsi.org/core/Command,IS-A,,,,"The command to realise the ""Connection"" function.",https://www.theworldavatar.com/kg/ontovapourtec/,
LoadExperiment,Class,https://saref.etsi.org/core/Command,IS-A,,,,"The command to realise the ""RunReactor"" function.",https://www.theworldavatar.com/kg/ontovapourtec/,
ClearReactions,Class,https://saref.etsi.org/core/Command,IS-A,,,,"The command to realise the ""CleanReactor"" function.",https://www.theworldavatar.com/kg/ontovapourtec/,
GetCommand,Class,https://saref.etsi.org/core/Command,IS-A,,,,"The command to realise the ""GetState"" function.",https://www.theworldavatar.com/kg/ontovapourtec/,
FaultRecoveryCommand,Class,https://saref.etsi.org/core/Command,IS-A,,,,"The command to realise the ""FaultRecovery"" function.",https://www.theworldavatar.com/kg/ontovapourtec/,
Null,Class,VapourtecState,IS-A,,,,The state indicates the unknown status of Vapourtec module as the FlowCommander is not yet started.,https://www.theworldavatar.com/kg/ontovapourtec/,
Initialising,Class,VapourtecState,IS-A,,,,The state indicates the status of Vapourtec module when the reaction experiment is initialising and to be executed.,https://www.theworldavatar.com/kg/ontovapourtec/,
Inactive,Class,VapourtecState,IS-A,,,,The state indicates the situation where the FlowCommander is started but its connection with the Vapourtec module is not yet established.,https://www.theworldavatar.com/kg/ontovapourtec/,
Idle,Class,VapourtecState,IS-A,,,,The state indicates the Vapourtec module is idle and available for the next reaction.,https://www.theworldavatar.com/kg/ontovapourtec/,
RunningReaction,Class,VapourtecState,IS-A,,,,The state indicates the Vapourtec module is currently running a reaction.,https://www.theworldavatar.com/kg/ontovapourtec/,
ReactionCompleted,Class,VapourtecState,IS-A,,,,The state indicates the Vapourtec module has just completed a reaction.,https://www.theworldavatar.com/kg/ontovapourtec/,
CleaningReaction,Class,VapourtecState,IS-A,,,,The state indicates the Vapourtec module is cleaning the reactor.,https://www.theworldavatar.com/kg/ontovapourtec/,
FinalCleaning,Class,VapourtecState,IS-A,,,,The state indicates the Vapourtec module is cleaning the reactor and is in the final cleaning stage.,https://www.theworldavatar.com/kg/ontovapourtec/,
Faulty,Class,VapourtecState,IS-A,,,,The state indicates the Vapourtec module is out of service.,https://www.theworldavatar.com/kg/ontovapourtec/,
DryRunState,Class,VapourtecState,IS-A,,,,The state indicates the Vapourtec module is in dry run mode.,https://www.theworldavatar.com/kg/ontovapourtec/,
ExpFilePath,Class,https://www.theworldavatar.com/kg/ontolab/Argument,IS-A,,,,The argument that points to the file path of the experiment conditions to be executed by the Vapourtec module.,https://www.theworldavatar.com/kg/ontovapourtec/,
VapourtecR4ReactorTask,Class,https://saref.etsi.org/core/Task,IS-A,,,,The saref:Task that can be conducted by VapourtecR4Reactor.,https://www.theworldavatar.com/kg/ontovapourtec/,
VapourtecR4ReactorFunction,Class,https://saref.etsi.org/core/Function,IS-A,,,,The saref:Function of VapourtecR4Reactor.,https://www.theworldavatar.com/kg/ontovapourtec/,
VapourtecR4ReactorCommand,Class,https://saref.etsi.org/core/Command,IS-A,,,,The saref:Command of VapourtecR4Reactor.,https://www.theworldavatar.com/kg/ontovapourtec/,
VapourtecR2PumpTask,Class,https://saref.etsi.org/core/Task,IS-A,,,,The saref:Task that can be conducted by VapourtecR2Pump.,https://www.theworldavatar.com/kg/ontovapourtec/,
VapourtecR2PumpFunction,Class,https://saref.etsi.org/core/Function,IS-A,,,,The saref:Function of VapourtecR2Pump.,https://www.theworldavatar.com/kg/ontovapourtec/,
VapourtecR2PumpCommand,Class,https://saref.etsi.org/core/Command,IS-A,,,,The saref:Command of VapourtecR2Pump.,https://www.theworldavatar.com/kg/ontovapourtec/,
AutoSamplerTask,Class,https://saref.etsi.org/core/Task,IS-A,,,,The saref:Task that can be conducted by AutoSampler.,https://www.theworldavatar.com/kg/ontovapourtec/,
AutoSamplerFunction,Class,https://saref.etsi.org/core/Function,IS-A,,,,The saref:Function of AutoSampler.,https://www.theworldavatar.com/kg/ontovapourtec/,
AutoSamplerCommand,Class,https://saref.etsi.org/core/Command,IS-A,,,,The saref:Command of AutoSampler.,https://www.theworldavatar.com/kg/ontovapourtec/,
CollectionMethod,Class,,,,,,The method indicates how the product is collected.,https://www.theworldavatar.com/kg/ontovapourtec/,
SingleReceptacle,Class,CollectionMethod,IS-A,,,,A single container to host the collected product.,https://www.theworldavatar.com/kg/ontovapourtec/,
FractionCollector,Class,CollectionMethod,IS-A,,,,A fraction collector that will decide the site where the product will be collected.,https://www.theworldavatar.com/kg/ontovapourtec/,
toReceptacle,Object Property,,,SingleReceptacle,https://www.theworldavatar.com/kg/ontolab/WasteBottle,,The relation indicates the receptacle where the product will be collected.,https://www.theworldavatar.com/kg/ontovapourtec/,
https://saref.etsi.org/core/consistsOf,Object Property,,,VapourtecRS400,VapourtecR4Reactor,minimum 1,The relation indicates VapourtecR4Reactor is a part of VapourtecRS400.,https://www.theworldavatar.com/kg/ontolab/,
https://saref.etsi.org/core/consistsOf,Object Property,,,VapourtecRS400,VapourtecR2Pump,minimum 1,The relation indicates VapourtecR2Pump is a part of VapourtecRS400.,https://www.theworldavatar.com/kg/ontolab/,
https://saref.etsi.org/core/consistsOf,Object Property,,,VapourtecRS400,AutoSampler,maximum 1,The relation indicates AutoSampler is a part of VapourtecRS400.,https://www.theworldavatar.com/kg/ontolab/,
hasCollectionMethod,Object Property,,,VapourtecRS400,CollectionMethod,exactly 1,The relation indicates the collection method of VapourtecRS400.,https://www.theworldavatar.com/kg/ontolab/,
hasReactorMaterial,Object Property,,,VapourtecR4Reactor,http://www.theworldavatar.com/ontology/ontocape/chemical_process_system/CPS_behavior/behavior.owl#MaterialAmount,only,The relation between Vapourtec R4 reactor and the material from which it was made.,https://www.theworldavatar.com/kg/ontovapourtec/,
hasInternalDiameter,Object Property,,,VapourtecR4Reactor,http://www.ontology-of-units-of-measure.org/resource/om-2/Diameter,exactly 1,The relation between Vapourtec R4 reactor and its internal diameter.,https://www.theworldavatar.com/kg/ontovapourtec/,
hasReactorLength,Object Property,,,VapourtecR4Reactor,http://www.ontology-of-units-of-measure.org/resource/om-2/Length,exactly 1,The relation between Vapourtec R4 reactor and its reactor length.,https://www.theworldavatar.com/kg/ontovapourtec/,
hasReactorVolume,Object Property,,,VapourtecR4Reactor,http://www.ontology-of-units-of-measure.org/resource/om-2/Volume,exactly 1,The relation between Vapourtec R4 reactor and its volume.,https://www.theworldavatar.com/kg/ontovapourtec/,
hasReactorTemperatureUpperLimit,Object Property,,,VapourtecR4Reactor,http://www.ontology-of-units-of-measure.org/resource/om-2/CelsiusTemperature,exactly 1,The relation between Vapourtec R4 reactor and the upper limit of its operation temperature range.,https://www.theworldavatar.com/kg/ontovapourtec/,
hasReactorTemperatureLowerLimit,Object Property,,,VapourtecR4Reactor,http://www.ontology-of-units-of-measure.org/resource/om-2/CelsiusTemperature,exactly 1,The relation between Vapourtec R4 reactor and the lower limit of its operation temperature range.,https://www.theworldavatar.com/kg/ontovapourtec/,
https://www.theworldavatar.com/kg/ontolab/isSpecifiedBy,Object Property,,,VapourtecR4Reactor,ReactorSettings,maximum 1,The relation between Vapourtec R4 reactor and its settings at which the reactor is desired to be.,https://www.theworldavatar.com/kg/ontolab/,
https://www.theworldavatar.com/kg/ontolab/specifies,Object Property,https://www.theworldavatar.com/kg/ontolab/isSpecifiedBy,INVERSE-OF,ReactorSettings,VapourtecR4Reactor,maximum 1,The relation between reactor settings and the Vapourtec R4 reactor which the settings specify.,https://www.theworldavatar.com/kg/ontolab/,
hasReactorTemperatureSetting,Object Property,https://www.theworldavatar.com/kg/ontolab/hasSetting,IS-A,ReactorSettings,ReactorTemperatureSetting,maximum 1,The relation between reactor settings and specific reactor temperature setting.,https://www.theworldavatar.com/kg/ontovapourtec/,
hasResidenceTimeSetting,Object Property,https://www.theworldavatar.com/kg/ontolab/hasSetting,IS-A,ReactorSettings,ResidenceTimeSetting,maximum 1,The relation between reactor settings and specific reactor residence time setting.,https://www.theworldavatar.com/kg/ontovapourtec/,
https://www.theworldavatar.com/kg/ontolab/isSpecifiedBy,Object Property,,,VapourtecR2Pump,PumpSettings,maximum 1,The relation between Vapourtec R2 pump and its settings at which the pump is desired to be.,https://www.theworldavatar.com/kg/ontolab/,
hasReagentSource,Object Property,,,VapourtecR2Pump,https://www.theworldavatar.com/kg/ontolab/ReagentBottle,,The relation between the Vapourtec R2 Pump and its reagent source.,https://www.theworldavatar.com/kg/ontovapourtec/,
https://www.theworldavatar.com/kg/ontolab/specifies,Object Property,https://www.theworldavatar.com/kg/ontolab/isSpecifiedBy,INVERSE-OF,PumpSettings,VapourtecR2Pump,maximum 1,The relation between pump settings and the Vapourtec R2 pump which the settings specify.,https://www.theworldavatar.com/kg/ontolab/,
hasFlowRateSetting,Object Property,https://www.theworldavatar.com/kg/ontolab/hasSetting,IS-A,PumpSettings,https://www.theworldavatar.com/kg/ontolab/FlowRateSetting,maximum 1,The relation between pump settings and specific flow rate setting.,https://www.theworldavatar.com/kg/ontovapourtec/,
hasSampleLoopVolumeSetting,Object Property,https://www.theworldavatar.com/kg/ontolab/hasSetting,IS-A,PumpSettings,SampleLoopVolumeSetting,maximum 1,The relation between pump settings and specific sample loop volume setting.,https://www.theworldavatar.com/kg/ontovapourtec/,
hasStoichiometryRatioSetting,Object Property,https://www.theworldavatar.com/kg/ontolab/hasSetting,IS-A,PumpSettings,StoichiometryRatioSetting,maximum 1,The relation between pump settings and specific stoichiometry ratio setting.,https://www.theworldavatar.com/kg/ontovapourtec/,
pumpsLiquidFrom,Object Property,,,PumpSettings,AutoSamplerSite UNION https://www.theworldavatar.com/kg/ontolab/ReagentBottle,,"The relation indicates where the pump extracts liquid from, it can be an auto sampler site or a reagent bottle.",https://www.theworldavatar.com/kg/ontovapourtec/,
https://www.theworldavatar.com/kg/ontolab/hasQuantity,Object Property,,,ReactorTemperatureSetting,https://www.theworldavatar.com/kg/ontoreaction/ReactionTemperature,exactly 1,The relation between the reactor temperature setting and the quantity it refers to following the units of measure practice.,https://www.theworldavatar.com/kg/ontolab/,
https://www.theworldavatar.com/kg/ontolab/hasQuantity,Object Property,,,ResidenceTimeSetting,https://www.theworldavatar.com/kg/ontoreaction/ResidenceTime,exactly 1,The relation between the reactor residence time setting and the quantity it refers to following the units of measure practice.,https://www.theworldavatar.com/kg/ontolab/,
https://www.theworldavatar.com/kg/ontolab/hasQuantity,Object Property,,,https://www.theworldavatar.com/kg/ontolab/FlowRateSetting,http://www.ontology-of-units-of-measure.org/resource/om-2/VolumetricFlowRate,exactly 1,The relation between the flow rate setting and the quantity it refers to following the units of measure practice.,https://www.theworldavatar.com/kg/ontolab/,
https://www.theworldavatar.com/kg/ontolab/hasQuantity,Object Property,,,SampleLoopVolumeSetting,http://www.ontology-of-units-of-measure.org/resource/om-2/Volume,exactly 1,The relation between the sample loop volume setting and the quantity it refers to following the units of measure practice.,https://www.theworldavatar.com/kg/ontolab/,
https://www.theworldavatar.com/kg/ontolab/hasQuantity,Object Property,,,StoichiometryRatioSetting,https://www.theworldavatar.com/kg/ontoreaction/StoichiometryRatio,exactly 1,The relation between the stoichiometry ratio setting and the quantity it refers to following the units of measure practice.,https://www.theworldavatar.com/kg/ontolab/,
sampleLoopVolume,Object Property,,,AutoSampler,http://www.ontology-of-units-of-measure.org/resource/om-2/Volume,,The relation between autosampler and its sample loop volume settings.,https://www.theworldavatar.com/kg/ontolab/,
hasSite,Object Property,,,AutoSampler,AutoSamplerSite,only,The relation between the auto sampler and the sites it has.,https://www.theworldavatar.com/kg/ontovapourtec/,
holds,Object Property,,,AutoSamplerSite,https://www.theworldavatar.com/kg/ontolab/Vial,maximum 1,The relation between the auto sampler site and the vial it holds.,https://www.theworldavatar.com/kg/ontovapourtec/,
isHeldIn,Object Property,holds,INVERSE-OF,https://www.theworldavatar.com/kg/ontolab/Vial,AutoSamplerSite,maximum 1,The relation between the vial and the auto sampler site where it locates.,https://www.theworldavatar.com/kg/ontovapourtec/,
https://saref.etsi.org/core/offers,Object Property,,,VapourtecRS400,FlowCommander,only,The relation between the VapourtecRS400 and the FlowCommander service it offers.,https://saref.etsi.org/core/v3.1.1/,
https://saref.etsi.org/core/isOfferedBy,Object Property,https://saref.etsi.org/core/offers,INVERSE-OF,FlowCommander,VapourtecRS400,only,The relation between FlowCommander service and the VapourtecRS400 that offers the service.,https://saref.etsi.org/core/v3.1.1/,
https://saref.etsi.org/core/represents,Object Property,,,FlowCommander,VapourtecFunction,only,The relation between FlowCommander service and its functions.,https://saref.etsi.org/core/v3.1.1/,
https://saref.etsi.org/core/accomplishes,Object Property,,,VapourtecRS400,FlowChemistry,some,The relation between VapourtecRS400 and the flow chemistry task it can conduct.,https://saref.etsi.org/core/v3.1.1/,
https://saref.etsi.org/core/isAccomplishedBy,Object Property,https://saref.etsi.org/core/accomplishes,INVERSE-OF,FlowChemistry,VapourtecRS400,some,The relation identifies that the VapourtecRS400 that can accomplish the flow chemistry task.,https://saref.etsi.org/core/v3.1.1/,
https://saref.etsi.org/core/hasFunction,Object Property,,,VapourtecRS400,VapourtecFunction,only,The relation identifies the functions of VapourtecRS400.,https://saref.etsi.org/core/v3.1.1/,
https://saref.etsi.org/core/hasState,Object Property,,,VapourtecRS400,VapourtecState,only,The relation identifies the type of states of VapourtecRS400.,https://saref.etsi.org/core/v3.1.1/,
https://saref.etsi.org/core/hasCommand,Object Property,,,Launch,StartFlowCommander,only,The relation between Launch function and StartFlowCommander command.,https://saref.etsi.org/core/v3.1.1/,
https://saref.etsi.org/core/hasCommand,Object Property,,,Connection,ConnectToFlowCommander,only,The relation between Connection function and ConnectToFlowCommander command.,https://saref.etsi.org/core/v3.1.1/,
https://saref.etsi.org/core/hasCommand,Object Property,,,RunReactor,LoadExperiment,only,The relation between RunReactor function and LoadExperiment command.,https://saref.etsi.org/core/v3.1.1/,
https://saref.etsi.org/core/hasCommand,Object Property,,,CleanReactor,ClearReactions,only,The relation between CleanReactor function and ClearReactions command.,https://saref.etsi.org/core/v3.1.1/,
https://saref.etsi.org/core/hasCommand,Object Property,,,GetState,GetCommand,only,The relation between GetState function and GetCommand command.,https://saref.etsi.org/core/v3.1.1/,
https://saref.etsi.org/core/hasCommand,Object Property,,,FaultRecovery,FaultRecoveryCommand,only,The relation between FaultRecovery function and FaultRecoveryCommand command.,https://saref.etsi.org/core/v3.1.1/,
https://saref.etsi.org/core/isCommandOf,Object Property,https://saref.etsi.org/core/hasCommand,INVERSE-OF,StartFlowCommander,Launch,only,The relation between StartFlowCommander command and Launch function it can achieve.,https://saref.etsi.org/core/v3.1.1/,
https://saref.etsi.org/core/isCommandOf,Object Property,https://saref.etsi.org/core/hasCommand,INVERSE-OF,ConnectToFlowCommander,Connection,only,The relation between ConnectToFlowCommander command and Connection function it can achieve.,https://saref.etsi.org/core/v3.1.1/,
https://saref.etsi.org/core/isCommandOf,Object Property,https://saref.etsi.org/core/hasCommand,INVERSE-OF,LoadExperiment,RunReactor,only,The relation between LoadExperiment command and RunReactor function it can achieve.,https://saref.etsi.org/core/v3.1.1/,
https://saref.etsi.org/core/isCommandOf,Object Property,https://saref.etsi.org/core/hasCommand,INVERSE-OF,ClearReactions,CleanReactor,only,The relation between ClearReactions command and CleanReactor function it can achieve.,https://saref.etsi.org/core/v3.1.1/,
https://saref.etsi.org/core/isCommandOf,Object Property,https://saref.etsi.org/core/hasCommand,INVERSE-OF,GetCommand,GetState,only,The relation between GetCommand command and GetState function it can achieve.,https://saref.etsi.org/core/v3.1.1/,
https://saref.etsi.org/core/isCommandOf,Object Property,https://saref.etsi.org/core/hasCommand,INVERSE-OF,FaultRecoveryCommand,FaultRecovery,only,The relation between FaultRecoveryCommand command and FaultRecovery function it can achieve.,https://saref.etsi.org/core/v3.1.1/,
https://saref.etsi.org/core/actsUpon,Object Property,,,GetCommand,VapourtecState,only,The relation indicates that the GetCommand can act upon all VapourtecState.,https://saref.etsi.org/core/v3.1.1/,
https://saref.etsi.org/core/actsUpon,Object Property,,,StartFlowCommander,Null,only,The relation indicates that the StartFlowCommander command can act upon Null state.,https://saref.etsi.org/core/v3.1.1/,
https://saref.etsi.org/core/actsUpon,Object Property,,,ConnectToFlowCommander,Inactive,only,The relation indicates that the ConnectToFlowCommander command can act upon Inactive state.,https://saref.etsi.org/core/v3.1.1/,
https://saref.etsi.org/core/actsUpon,Object Property,,,LoadExperiment,Idle,only,The relation indicates that the LoadExperiment command can act upon Idle state.,https://saref.etsi.org/core/v3.1.1/,
https://saref.etsi.org/core/actsUpon,Object Property,,,ClearReactions,ReactionCompleted,only,The relation indicates that the ClearReactions command can act upon ReactionCompleted state.,https://saref.etsi.org/core/v3.1.1/,
https://saref.etsi.org/core/actsUpon,Object Property,,,FaultRecoveryCommand,Faulty,only,The relation indicates that the FaultRecoveryCommand can act upon Faulty state.,https://saref.etsi.org/core/v3.1.1/,
https://saref.etsi.org/core/accomplishes,Object Property,,,VapourtecR4Reactor,VapourtecR4ReactorTask,some,The relation between VapourtecR4Reactor and the task it can conduct.,https://saref.etsi.org/core/v3.1.1/,
https://saref.etsi.org/core/isAccomplishedBy,Object Property,https://saref.etsi.org/core/accomplishes,INVERSE-OF,VapourtecR4ReactorTask,,some,The relation identifies that the VapourtecR4Reactor that can accomplish its task.,https://saref.etsi.org/core/v3.1.1/,
https://saref.etsi.org/core/hasFunction,Object Property,,,VapourtecR4Reactor,VapourtecR4ReactorFunction,only,The relation identifies the functions of VapourtecR4Reactor.,https://saref.etsi.org/core/v3.1.1/,
https://saref.etsi.org/core/hasCommand,Object Property,,,VapourtecR4ReactorFunction,VapourtecR4ReactorCommand,only,The relation between VapourtecR4ReactorFunction function and VapourtecR4ReactorCommand command.,https://saref.etsi.org/core/v3.1.1/,
https://saref.etsi.org/core/isCommandOf,Object Property,https://saref.etsi.org/core/hasCommand,INVERSE-OF,VapourtecR4ReactorCommand,VapourtecR4ReactorFunction,only,The relation between VapourtecR4ReactorCommand command and VapourtecR4ReactorFunction function it can achieve.,https://saref.etsi.org/core/v3.1.1/,
https://saref.etsi.org/core/accomplishes,Object Property,,,VapourtecR2Pump,VapourtecR2PumpTask,some,The relation between VapourtecR2Pump and the task it can conduct.,https://saref.etsi.org/core/v3.1.1/,
