Source,Type,Target,Relation,Domain,Range,Quantifier,Comment,Defined By,Label
https://saref.etsi.org/core/isAccomplishedBy,Object Property,https://saref.etsi.org/core/accomplishes,INVERSE-OF,VapourtecR2PumpTask,,some,The relation identifies that the VapourtecR2Pump that can accomplish the VapourtecR2PumpTask task.,https://saref.etsi.org/core/v3.1.1/,
https://saref.etsi.org/core/hasFunction,Object Property,,,VapourtecR2Pump,VapourtecR2PumpFunction,only,The relation identifies the functions of VapourtecR2Pump.,https://saref.etsi.org/core/v3.1.1/,
https://saref.etsi.org/core/hasCommand,Object Property,,,VapourtecR2PumpFunction,VapourtecR2PumpCommand,only,The relation between VapourtecR2PumpFunction function and VapourtecR2PumpCommand command.,https://saref.etsi.org/core/v3.1.1/,
https://saref.etsi.org/core/isCommandOf,Object Property,https://saref.etsi.org/core/hasCommand,INVERSE-OF,VapourtecR2PumpCommand,VapourtecR2PumpFunction,only,The relation between VapourtecR2PumpCommand command and VapourtecR2PumpFunction function it can achieve.,https://saref.etsi.org/core/v3.1.1/,
https://saref.etsi.org/core/accomplishes,Object Property,,,AutoSampler,AutoSamplerTask,some,The relation between AutoSampler and the task it can conduct.,https://saref.etsi.org/core/v3.1.1/,
https://saref.etsi.org/core/isAccomplishedBy,Object Property,https://saref.etsi.org/core/accomplishes,INVERSE-OF,AutoSamplerTask,,some,The relation identifies that the AutoSampler that can accomplish the AutoSamplerTask task.,https://saref.etsi.org/core/v3.1.1/,
https://saref.etsi.org/core/hasFunction,Object Property,,,AutoSampler,AutoSamplerFunction,only,The relation identifies the functions of AutoSampler.,https://saref.etsi.org/core/v3.1.1/,
https://saref.etsi.org/core/hasCommand,Object Property,,,AutoSamplerFunction,AutoSamplerCommand,only,The relation between AutoSamplerFunction function and AutoSamplerCommand command.,https://saref.etsi.org/core/v3.1.1/,
https://saref.etsi.org/core/isCommandOf,Object Property,https://saref.etsi.org/core/hasCommand,INVERSE-OF,AutoSamplerCommand,AutoSamplerFunction,only,The relation between AutoSamplerCommand command and AutoSamplerFunction function it can achieve.,https://saref.etsi.org/core/v3.1.1/,
locationID,Data Property,,,VapourtecR4Reactor UNION VapourtecR2Pump UNION AutoSamplerSite,string,,,https://www.theworldavatar.com/kg/ontovapourtec/,
