Source,Type,Target,Relation,Domain,Range,Quantifier,Comment,Defined By,Label
OntoZoning,TBox,https://www.theworldavatar.com/kg/ontozoning/,https://www.w3.org/2007/05/powder-s#hasIRI,,,,,,
OntoZoning,TBox,1,http://www.w3.org/2002/07/owl#versionInfo,,,,,,
OntoZoning,TBox,"OntoZoning is an ontology developed to represent relationships between zoning types, land uses and programmes (more specific land uses).",http://www.w3.org/2000/01/rdf-schema#comment,,,,,,
OntoZoning,TBox,,http://www.w3.org/2002/07/owl#imports,,,,,,
LandUse,Class,,,,,,"Broad land use categories that are allowed in a specific zoning type in Singapore. Land uses may have further regulations attached, e.g. maximum use quantums. For example, a land use might be ‘Commercial or Hotel Use in Commercial Zone’. This land use is broad in the sense that a commercial use encompasses more specific uses like ‘restaurant’, ‘bar’ and ‘bookstore.’ This land use is necessary to describe at this level of detail because in Singapore, a minimum use quantum of 60% applies to it, meaning that at least 60% of the GFA of a plot zoned as Commercial must be devoted to a mix of different commercial or hotel uses which may include, for example, &apos;restaurant&apos;, &apos;bar&apos;, and &apos;bookstore&apos;.",https://www.theworldavatar.com/kg/ontozoning/,Land Use
AgriculturalUse,Class,LandUse,IS-A,,,,,https://www.theworldavatar.com/kg/ontozoning/,Agricultural Use
AirportUse,Class,LandUse,IS-A,,,,,https://www.theworldavatar.com/kg/ontozoning/,Airport Use
AncillaryAgriculturalUse,Class,LandUse,IS-A,,,,,https://www.theworldavatar.com/kg/ontozoning/,Ancillary Agricultural Use
AncillaryNonReligiousUse,Class,LandUse,IS-A,,,,,https://www.theworldavatar.com/kg/ontozoning/,Ancillary Non Religious Use
AncillaryReligiousUse,Class,LandUse,IS-A,,,,,https://www.theworldavatar.com/kg/ontozoning/,Ancillary Religious Use
AncillaryUseBusiness1,Class,LandUse,IS-A,,,,,https://www.theworldavatar.com/kg/ontozoning/,Ancillary Use Business 1
AncillaryUseBusiness1White,Class,LandUse,IS-A,,,,,https://www.theworldavatar.com/kg/ontozoning/,Ancillary Use Business 1 White
AncillaryUseBusiness2,Class,LandUse,IS-A,,,,,https://www.theworldavatar.com/kg/ontozoning/,Ancillary Use Business 2
AncillaryUseBusiness2White,Class,LandUse,IS-A,,,,,https://www.theworldavatar.com/kg/ontozoning/,Ancillary Use Business 2 White
AncillaryUseBusinessPark,Class,LandUse,IS-A,,,,,https://www.theworldavatar.com/kg/ontozoning/,Ancillary Use Business Park
AncillaryUseBusinessParkWhite,Class,LandUse,IS-A,,,,,https://www.theworldavatar.com/kg/ontozoning/,Ancillary Use Business Park White
AncillaryUseEducationalInstitutionZone,Class,LandUse,IS-A,,,,,https://www.theworldavatar.com/kg/ontozoning/,Ancillary Use Educational Institution Zone
BuiltOpenSpace,Class,LandUse,IS-A,,,,,https://www.theworldavatar.com/kg/ontozoning/,Built Open Space
CemeteryUse,Class,LandUse,IS-A,,,,,https://www.theworldavatar.com/kg/ontozoning/,Cemetery Use
CivicInstitutionUse,Class,LandUse,IS-A,,,,,https://www.theworldavatar.com/kg/ontozoning/,Civic Institution Use
CoastalRecreationUse,Class,LandUse,IS-A,,,,,https://www.theworldavatar.com/kg/ontozoning/,Coastal Recreation Use
ColumbariumUse,Class,LandUse,IS-A,,,,,https://www.theworldavatar.com/kg/ontozoning/,Columbarium Use
CommercialOrHotelUseCommercialAndResidentialZone,Class,LandUse,IS-A,,,,,https://www.theworldavatar.com/kg/ontozoning/,Commercial Or Hotel Use Commercial And Residential Zone
CommercialUseBusiness1,Class,LandUse,IS-A,,,,,https://www.theworldavatar.com/kg/ontozoning/,Commercial Use Business 1
CommercialUseCommercialOrInstitutionZone,Class,LandUse,IS-A,,,,,https://www.theworldavatar.com/kg/ontozoning/,Commercial Use Commercial Or Institution Zone
CommercialUseCommercialZone,Class,LandUse,IS-A,,,,,https://www.theworldavatar.com/kg/ontozoning/,Commercial Use Commercial Zone
CommercialUseHealthAndMedicalCareZone,Class,LandUse,IS-A,,,,,https://www.theworldavatar.com/kg/ontozoning/,Commercial Use Health And Medical Care Zone
CommercialUseHotelZone,Class,LandUse,IS-A,,,,,https://www.theworldavatar.com/kg/ontozoning/,Commercial Use Hotel Zone
CommercialUseResidentialWithCommercialAtFirstStorey,Class,LandUse,IS-A,,,,,https://www.theworldavatar.com/kg/ontozoning/,Commercial Use Residential With Commercial At First Storey
CommercialUseWhiteZone,Class,LandUse,IS-A,,,,,https://www.theworldavatar.com/kg/ontozoning/,Commercial Use White Zone
CommunityInstitutionExcludingDormitoryAndFuneral,Class,LandUse,IS-A,,,,,https://www.theworldavatar.com/kg/ontozoning/,Community Institution Excluding Dormitory And Funeral
CommunityInstitutionResidentialOrInstitutionZone,Class,LandUse,IS-A,,,,,https://www.theworldavatar.com/kg/ontozoning/,Community Institution Residential Or Institution Zone
CommunityInstitutionUseCivicAndCommunityInstitutionZone,Class,LandUse,IS-A,,,,,https://www.theworldavatar.com/kg/ontozoning/,Community Institution Use Civic And Community Institution Zone
CulturalInstitutionUse,Class,LandUse,IS-A,,,,,https://www.theworldavatar.com/kg/ontozoning/,Cultural Institution Use
DrainageUse,Class,LandUse,IS-A,,,,,https://www.theworldavatar.com/kg/ontozoning/,Drainage Use
EducationalInstitutionUse,Class,LandUse,IS-A,,,,,https://www.theworldavatar.com/kg/ontozoning/,Educational Institution Use
FlatOrCondominiumAncillaryShopUseResidentialZone,Class,LandUse,IS-A,,,,,https://www.theworldavatar.com/kg/ontozoning/,Flat Or Condominium Ancillary Shop Use Residential Zone
FlatOrCondominiumAncillaryShopUseWhiteZone,Class,LandUse,IS-A,,,,,https://www.theworldavatar.com/kg/ontozoning/,Flat Or Condominium Ancillary Shop Use White Zone
FlatOrCondominiumAncillaryUseResidentialOrInstitutionZone,Class,LandUse,IS-A,,,,,https://www.theworldavatar.com/kg/ontozoning/,Flat Or Condominium Ancillary Use Residential Or Institution Zone
FlatOrCondominiumUseCommercialAndResidentialZone,Class,LandUse,IS-A,,,,,https://www.theworldavatar.com/kg/ontozoning/,Flat Or Condominium Use Commercial And Residential Zone
FlatOrCondominiumUseCommercialOrInstitutionZone,Class,LandUse,IS-A,,,,,https://www.theworldavatar.com/kg/ontozoning/,Flat Or Condominium Use Commercial Or Institution Zone
FlatOrCondominiumUseResidentialOrInstitutionZone,Class,LandUse,IS-A,,,,,https://www.theworldavatar.com/kg/ontozoning/,Flat Or Condominium Use Residential Or Institution Zone
FlatOrCondominiumUseResidentialWithCommercialAtFirstStorey,Class,LandUse,IS-A,,,,,https://www.theworldavatar.com/kg/ontozoning/,Flat Or Condominium Use Residential With Commercial At First Storey
FlatOrCondominiumUseResidentialZone,Class,LandUse,IS-A,,,,,https://www.theworldavatar.com/kg/ontozoning/,Flat Or Condominium Use Residential Zone
FlatOrCondominiumUseWhiteZone ,Class,LandUse,IS-A,,,,,https://www.theworldavatar.com/kg/ontozoning/,Flat Or Condominium Use White Zone 
GardenUse,Class,LandUse,IS-A,,,,,https://www.theworldavatar.com/kg/ontozoning/,Garden Use
GolfUse,Class,LandUse,IS-A,,,,,https://www.theworldavatar.com/kg/ontozoning/,Golf Use
HostelUseHealthAndMedicalCareZone,Class,LandUse,IS-A,,,,,https://www.theworldavatar.com/kg/ontozoning/,Hostel Use Health And Medical Care Zone
HostelUseResidentialZone,Class,LandUse,IS-A,,,,,https://www.theworldavatar.com/kg/ontozoning/,Hostel Use Residential Zone
HotelUseCommercialOrInstitutionZone,Class,LandUse,IS-A,,,,,https://www.theworldavatar.com/kg/ontozoning/,Hotel Use Commercial Or Institution Zone
HotelUseHotelZone,Class,LandUse,IS-A,,,,,https://www.theworldavatar.com/kg/ontozoning/,Hotel Use Hotel Zone
HotelUseWhiteZone,Class,LandUse,IS-A,,,,,https://www.theworldavatar.com/kg/ontozoning/,Hotel Use White Zone
InfrastructureUse,Class,LandUse,IS-A,,,,,https://www.theworldavatar.com/kg/ontozoning/,Infrastructure Use
InterimUse,Class,LandUse,IS-A,,,,,https://www.theworldavatar.com/kg/ontozoning/,Interim Use
LandedHousingUse,Class,LandUse,IS-A,,,,,https://www.theworldavatar.com/kg/ontozoning/,Landed Housing Use
MainUseBusiness1,Class,LandUse,IS-A,,,,,https://www.theworldavatar.com/kg/ontozoning/,Main Use Business 1
MainUseBusiness1White,Class,LandUse,IS-A,,,,,https://www.theworldavatar.com/kg/ontozoning/,Main Use Business 1 White
MainUseBusiness2,Class,LandUse,IS-A,,,,,https://www.theworldavatar.com/kg/ontozoning/,Main Use Business 2
MainUseBusiness2White,Class,LandUse,IS-A,,,,,https://www.theworldavatar.com/kg/ontozoning/,Main Use Business 2 White
MainUseBusinessPark,Class,LandUse,IS-A,,,,,https://www.theworldavatar.com/kg/ontozoning/,Main Use Business Park
MainUseBusinessParkWhite,Class,LandUse,IS-A,,,,,https://www.theworldavatar.com/kg/ontozoning/,Main Use Business Park White
MarinaUse,Class,LandUse,IS-A,,,,,https://www.theworldavatar.com/kg/ontozoning/,Marina Use
MedicalUse,Class,LandUse,IS-A,,,,,https://www.theworldavatar.com/kg/ontozoning/,Medical Use
OtherAncillaryUseHealthAndMedicalCareZone,Class,LandUse,IS-A,,,,,https://www.theworldavatar.com/kg/ontozoning/,Other Ancillary Use Health And Medical Care Zone
OtherUseUnderElevatedRoad,Class,LandUse,IS-A,,,,,https://www.theworldavatar.com/kg/ontozoning/,Other Use Under Elevated Road
ParkUse,Class,LandUse,IS-A,,,,,https://www.theworldavatar.com/kg/ontozoning/,Park Use
PedestrianLinkage,Class,LandUse,IS-A,,,,,https://www.theworldavatar.com/kg/ontozoning/,Pedestrian Linkage
PetrolStationAncillaryUse,Class,LandUse,IS-A,,,,,https://www.theworldavatar.com/kg/ontozoning/,Petrol Station Ancillary Use
PetrolStationCommercialUse,Class,LandUse,IS-A,,,,,https://www.theworldavatar.com/kg/ontozoning/,Petrol Station Commercial Use
PetrolStationMainUse,Class,LandUse,IS-A,,,,,https://www.theworldavatar.com/kg/ontozoning/,Petrol Station Main Use
PortUse,Class,LandUse,IS-A,,,,,https://www.theworldavatar.com/kg/ontozoning/,Port Use
PredominantReligiousUse,Class,LandUse,IS-A,,,,,https://www.theworldavatar.com/kg/ontozoning/,Predominant Religious Use
PrivateMedicalClinicBusiness1White,Class,LandUse,IS-A,,,,,https://www.theworldavatar.com/kg/ontozoning/,Private Medical Clinic Business 1 White
PrivateMedicalClinicBusiness2White,Class,LandUse,IS-A,,,,,https://www.theworldavatar.com/kg/ontozoning/,Private Medical Clinic Business 2 White
PrivateMedicalClinicBusinessPark,Class,LandUse,IS-A,,,,,https://www.theworldavatar.com/kg/ontozoning/,Private Medical Clinic Business Park
PrivateMedicalClinicBusinessParkWhite,Class,LandUse,IS-A,,,,,https://www.theworldavatar.com/kg/ontozoning/,Private Medical Clinic Business Park White
PrivateMedicalClinicCommercialAndResidentialZone,Class,LandUse,IS-A,,,,,https://www.theworldavatar.com/kg/ontozoning/,Private Medical Clinic Commercial And Residential Zone
PrivateMedicalClinicCommercialZone,Class,LandUse,IS-A,,,,,https://www.theworldavatar.com/kg/ontozoning/,Private Medical Clinic Commercial Zone
PrivateMedicalClinicHotelZone,Class,LandUse,IS-A,,,,,https://www.theworldavatar.com/kg/ontozoning/,Private Medical Clinic Hotel Zone
PrivateMedicalClinicResidentialWithCommercialAtFirstStorey,Class,LandUse,IS-A,,,,,https://www.theworldavatar.com/kg/ontozoning/,Private Medical Clinic Residential With Commercial At First Storey
PrivateMedicalClinicWhiteZone,Class,LandUse,IS-A,,,,,https://www.theworldavatar.com/kg/ontozoning/,Private Medical Clinic White Zone
PublicInstallationUse,Class,LandUse,IS-A,,,,,https://www.theworldavatar.com/kg/ontozoning/,Public Installation Use
PublicUtilityUse,Class,LandUse,IS-A,,,,,https://www.theworldavatar.com/kg/ontozoning/,Public Utility Use
RapidTransitUse,Class,LandUse,IS-A,,,,,https://www.theworldavatar.com/kg/ontozoning/,Rapid Transit Use
RecreationClubUse,Class,LandUse,IS-A,,,,,https://www.theworldavatar.com/kg/ontozoning/,Recreation Club Use
RecreationClubUseCommercialOrInstitutionZone,Class,LandUse,IS-A,,,,,https://www.theworldavatar.com/kg/ontozoning/,Recreation Club Use Commercial Or Institution Zone
RecreationClubUseCommercialZone,Class,LandUse,IS-A,,,,,https://www.theworldavatar.com/kg/ontozoning/,Recreation Club Use Commercial Zone
RecreationClubUseWhiteZone,Class,LandUse,IS-A,,,,,https://www.theworldavatar.com/kg/ontozoning/,Recreation Club Use White Zone
ResortUse,Class,LandUse,IS-A,,,,,https://www.theworldavatar.com/kg/ontozoning/,Resort Use
RetirementHousingUse,Class,LandUse,IS-A,,,,,https://www.theworldavatar.com/kg/ontozoning/,Retirement Housing Use
RoadUse,Class,LandUse,IS-A,,,,,https://www.theworldavatar.com/kg/ontozoning/,Road Use
ServicedApartmentAncillaryUseResidentialZone,Class,LandUse,IS-A,,,,,https://www.theworldavatar.com/kg/ontozoning/,Serviced Apartment Ancillary Use Residential Zone
ServicedApartmentAncillaryUseWhiteZone,Class,LandUse,IS-A,,,,,https://www.theworldavatar.com/kg/ontozoning/,Serviced Apartment Ancillary Use White Zone
ServicedApartmentUseResidentialZone,Class,LandUse,IS-A,,,,,https://www.theworldavatar.com/kg/ontozoning/,Serviced Apartment Use Residential Zone
ServicedApartmentUseWhiteZone,Class,LandUse,IS-A,,,,,https://www.theworldavatar.com/kg/ontozoning/,Serviced Apartment Use White Zone
ShopHouseUseGeneral,Class,LandUse,IS-A,,,,,https://www.theworldavatar.com/kg/ontozoning/,Shop House Use General
SpecialUse,Class,LandUse,IS-A,,,,,https://www.theworldavatar.com/kg/ontozoning/,Special Use
SportsComplexUse,Class,LandUse,IS-A,,,,,https://www.theworldavatar.com/kg/ontozoning/,Sports Complex Use
StadiumUse,Class,LandUse,IS-A,,,,,https://www.theworldavatar.com/kg/ontozoning/,Stadium Use
TelecommunicationUse,Class,LandUse,IS-A,,,,,https://www.theworldavatar.com/kg/ontozoning/,Telecommunication Use
UnbuiltOpenSpace,Class,LandUse,IS-A,,,,,https://www.theworldavatar.com/kg/ontozoning/,Unbuilt Open Space
UndeterminedUse,Class,LandUse,IS-A,,,,,https://www.theworldavatar.com/kg/ontozoning/,Undetermined Use
VehicleParkingUse,Class,LandUse,IS-A,,,,,https://www.theworldavatar.com/kg/ontozoning/,Vehicle Parking Use
WaterAreaUse,Class,LandUse,IS-A,,,,,https://www.theworldavatar.com/kg/ontozoning/,Water Area Use
WaterSportsCentreUse,Class,LandUse,IS-A,,,,,https://www.theworldavatar.com/kg/ontozoning/,Water Sports Centre Use
WhiteUseBusiness1White,Class,LandUse,IS-A,,,,,https://www.theworldavatar.com/kg/ontozoning/,White Use Business 1 White
WhiteUseBusiness2White,Class,LandUse,IS-A,,,,,https://www.theworldavatar.com/kg/ontozoning/,White Use Business 2 White
WhiteUseBusinessPark,Class,LandUse,IS-A,,,,,https://www.theworldavatar.com/kg/ontozoning/,White Use Business Park
WhiteUseBusinessParkWhite,Class,LandUse,IS-A,,,,,https://www.theworldavatar.com/kg/ontozoning/,White Use Business Park White
ZoningType,Class,,,,,,The zoning type is a legally-binding description of the permittable ‘uses’ and ‘developments’ that are or may not be allowed to be constructed within a specific zone or area delineated. Zoning types are defined by a governing authority and are usually tailored to specific contexts.,https://www.theworldavatar.com/kg/ontozoning/,Zoning Type
Agriculture,Class,ZoningType,IS-A,,,,These are areas used or intended to be used for agricultural purposes and includes plant nursery.,https://www.theworldavatar.com/kg/ontozoning/,Agriculture
BeachArea,Class,ZoningType,IS-A,,,,These are areas used or intended to be used for coastal recreational purposes for the enjoyment of the general public.,https://www.theworldavatar.com/kg/ontozoning/,Beach Area
Business1,Class,ZoningType,IS-A,,,,"A zoning type tailored to URA in Singapore. These are areas used or intended to be used mainly for clean industry, light industry, public utilities, and telecommunication uses and other public installations for which the relevant authority does not impose a nuisance buffer greater than 50m. General industrial uses that are able to meet the nuisance buffer requirements imposed by the relevant authority for general industries may be allowed in the B1 zones, subject to evaluation by the relevant authority and the competent authority.",https://www.theworldavatar.com/kg/ontozoning/,Business 1
Business1White,Class,Business1,IS-A,,,,These are areas used or intended to be used mainly for uses permissible under B1 zone and White zone as a mixed use development.,https://www.theworldavatar.com/kg/ontozoning/,Business 1 White
Business2,Class,ZoningType,IS-A,,,,"A zoning type tailored to URA in Singapore. There are areas used or intended to be used for clean industry, light industry, general industry, warehouse, public utilities and telecommunication uses and other public installations. Special industries such as manufacture of industrial machinery, shipbuilding and repairing, may be allowed in selected areas subject to evaluation by the relevant authority and the competent authority.",https://www.theworldavatar.com/kg/ontozoning/,Business 2
Business2White,Class,Business2,IS-A,,,,These are areas used or intended to be used mainly for uses permissible under B2 zone and White zone as a mixed use development.,https://www.theworldavatar.com/kg/ontozoning/,Business 2 White
BusinessPark,Class,ZoningType,IS-A,,,,These are areas used or intended to be used for business park operations.,https://www.theworldavatar.com/kg/ontozoning/,Business Park
BusinessParkWhite,Class,BusinessPark,IS-A,,,,These are areas used or intended to be used mainly for business park operations and other uses permissible under White zone as a mixed use development.,https://www.theworldavatar.com/kg/ontozoning/,Business Park White
CemeteryZone,Class,ZoningType,IS-A,,,,"These are areas used or intended to be used for burial grounds, crematoria and columbaria.",https://www.theworldavatar.com/kg/ontozoning/,Cemetery Zone
CivicAndCommunityInstitutionZone,Class,ZoningType,IS-A,,,,"These are areas used or intended to be used mainly for civic, community or cultural facilities or other similar purposes.",https://www.theworldavatar.com/kg/ontozoning/,Civic And Community Institution Zone
Commercial,Class,ZoningType,IS-A,,,,These are areas used or intended to be used mainly for commercial development.,https://www.theworldavatar.com/kg/ontozoning/,Commercial
CommercialAndResidential,Class,ZoningType,IS-A,,,,These are areas used or intended to be used mainly for mixed commercial and residential development.,https://www.theworldavatar.com/kg/ontozoning/,Commercial And Residential
CommercialOrInstitution,Class,ZoningType,IS-A,,,,"These are areas used or intended to be used mainly for commercial purpose, community institution facilities or other similar purposes.",https://www.theworldavatar.com/kg/ontozoning/,Commercial Or Institution
EducationalInstitution,Class,ZoningType,IS-A,,,,These are areas used or intended to be used mainly for educational purposes including tertiary education.,https://www.theworldavatar.com/kg/ontozoning/,Educational Institution
HealthAndMedicalCare,Class,ZoningType,IS-A,,,,These are areas used or intended to be used mainly for medical services.,https://www.theworldavatar.com/kg/ontozoning/,Health And Medical Care
HotelZone,Class,ZoningType,IS-A,,,,These are areas used or intended to be used mainly for hotel development,https://www.theworldavatar.com/kg/ontozoning/,Hotel Zone
OpenSpace,Class,ZoningType,IS-A,,,,These are areas used or intended to be used as open space.,https://www.theworldavatar.com/kg/ontozoning/,Open Space
Park,Class,ZoningType,IS-A,,,,These are areas used or intended to be used mainly for parks or gardens for the enjoyment of the general public and includes pedestrian linkages.,https://www.theworldavatar.com/kg/ontozoning/,Park
PlaceOfWorship,Class,ZoningType,IS-A,,,,These are areas used or intended to be used mainly for religious buildings.,https://www.theworldavatar.com/kg/ontozoning/,Place Of Worship
PortOrAirport,Class,ZoningType,IS-A,,,,These are areas used or intended to be used for airport/ airfield or dock/port purposes.,https://www.theworldavatar.com/kg/ontozoning/,Port Or Airport
RapidTransit,Class,ZoningType,IS-A,,,,These are areas used or intended to be used mainly for Rapid Transit purposes.,https://www.theworldavatar.com/kg/ontozoning/,Rapid Transit
ReserveSite,Class,ZoningType,IS-A,,,,These are areas the specific use of which has yet to be determined. Interim uses that are compatible with the uses in the locality may be allowed subject to evaluation by the competent authority.,https://www.theworldavatar.com/kg/ontozoning/,Reserve Site
Residential,Class,ZoningType,IS-A,,,,These are areas used or intended to be used mainly for residential development.,https://www.theworldavatar.com/kg/ontozoning/,Residential
ResidentialOrInstitution,Class,Residential,IS-A,,,,"These are areas used or intended to be used mainly for residential purpose, community institution facilities or other similar purposes.",https://www.theworldavatar.com/kg/ontozoning/,Residential Or Institution
ResidentialWithCommercialAtFirstStorey,Class,Residential,IS-A,,,,These are areas used or intended to be used mainly for residential development with commercial use at the first storey only.,https://www.theworldavatar.com/kg/ontozoning/,Residential With Commercial At First Storey
Road,Class,ZoningType,IS-A,,,,These are areas used or intended to be used for existing and proposed roads.,https://www.theworldavatar.com/kg/ontozoning/,Road
SpecialUseZone,Class,ZoningType,IS-A,,,,These are areas used or intended to be used for special purposes.,https://www.theworldavatar.com/kg/ontozoning/,Special Use Zone
SportsAndRecreation,Class,ZoningType,IS-A,,,,These are areas used or intended to be used mainly for sports and recreational purposes.,https://www.theworldavatar.com/kg/ontozoning/,Sports And Recreation
TransportFacilities,Class,ZoningType,IS-A,,,,These are areas used or intended to be used mainly for the parking of vehicles and transport facilities including garages and at-grade structure of underground road tunnel and rapid transit system.,https://www.theworldavatar.com/kg/ontozoning/,Transport Facilities
Utility,Class,ZoningType,IS-A,,,,"These are areas used or intended to be used mainly for public utilities and telecommunication infrastructure, including water works, sewage disposal works and other public installations such as electrical substations.",https://www.theworldavatar.com/kg/ontozoning/,Utility
Waterbody,Class,ZoningType,IS-A,,,,"These are areas used or intended to be used for drainage purposes and water areas such as reservoirs, ponds, rivers and other water channels.",https://www.theworldavatar.com/kg/ontozoning/,Waterbody
White,Class,ZoningType,IS-A,,,,"A zoning type tailored to URA in Singapore. These are areas used or intended to be used mainly for commercial, hotel, residential, sports & recreational and other compatible uses, or a combination of two or more such uses as a mixed development.",https://www.theworldavatar.com/kg/ontozoning/,White
Programme,Class,,,,,,"More specific land uses that are allowed in one or more broader land use categories. For example, ‘restaurant’, ‘bar’ and ‘bookstore’ are programmes. No use quantums are attached to programmes.",https://www.theworldavatar.com/kg/ontozoning/,Programme
http://ontology.eil.utoronto.ca/icity/LBCSv2/Activity,Class,Programme,IS-A,,,,,http://ontology.eil.utoronto.ca/icity/LBCSv2/,Activity
Agriculture,Class,Programme,IS-A,,,,,https://www.theworldavatar.com/kg/ontozoning/,Agriculture
AirportFacility,Class,Programme,IS-A,,,,,https://www.theworldavatar.com/kg/ontozoning/,Airport Facility
AirportTerminal,Class,Programme,IS-A,,,,,https://www.theworldavatar.com/kg/ontozoning/,Airport Terminal
AncillaryDisplayArea ,Class,Programme,IS-A,,,,,https://www.theworldavatar.com/kg/ontozoning/,Ancillary Display Area 
AncillaryOffice,Class,Programme,IS-A,,,,,https://www.theworldavatar.com/kg/ontozoning/,Ancillary Office
ArterialRoad,Class,Programme,IS-A,,,,,https://www.theworldavatar.com/kg/ontozoning/,Arterial Road
ArtGallery,Class,Programme,IS-A,,,,,https://www.theworldavatar.com/kg/ontozoning/,Art Gallery
ArtsCentre,Class,Programme,IS-A,,,,,https://www.theworldavatar.com/kg/ontozoning/,Arts Centre
Assembly,Class,Programme,IS-A,,,,,https://www.theworldavatar.com/kg/ontozoning/,Assembly
Association,Class,Programme,IS-A,,,,,https://www.theworldavatar.com/kg/ontozoning/,Association
Bakery,Class,Programme,IS-A,,,,,https://www.theworldavatar.com/kg/ontozoning/,Bakery
Bank,Class,Programme,IS-A,,,,,https://www.theworldavatar.com/kg/ontozoning/,Bank
Bar,Class,Programme,IS-A,,,,,https://www.theworldavatar.com/kg/ontozoning/,Bar
BeautySalon,Class,Programme,IS-A,,,,,https://www.theworldavatar.com/kg/ontozoning/,Beauty Salon
BotanicGarden,Class,Programme,IS-A,,,,,https://www.theworldavatar.com/kg/ontozoning/,Botanic Garden
BowlingAlley,Class,Programme,IS-A,,,,,https://www.theworldavatar.com/kg/ontozoning/,Bowling Alley
Bungalow,Class,Programme,IS-A,,,,,https://www.theworldavatar.com/kg/ontozoning/,Bungalow
Cafe,Class,Programme,IS-A,,,,,https://www.theworldavatar.com/kg/ontozoning/,Cafe
CallCentre,Class,Programme,IS-A,,,,,https://www.theworldavatar.com/kg/ontozoning/,Call Centre
CarDealer,Class,Programme,IS-A,,,,,https://www.theworldavatar.com/kg/ontozoning/,Car Dealer
CarPark,Class,Programme,IS-A,,,,,https://www.theworldavatar.com/kg/ontozoning/,Car Park
CarRental,Class,Programme,IS-A,,,,,https://www.theworldavatar.com/kg/ontozoning/,Car Rental
CarRepair,Class,Programme,IS-A,,,,,https://www.theworldavatar.com/kg/ontozoning/,Car Repair
CarWash,Class,Programme,IS-A,,,,,https://www.theworldavatar.com/kg/ontozoning/,Car Wash
CemeteryProgramme,Class,Programme,IS-A,,,,,https://www.theworldavatar.com/kg/ontozoning/,Cemetery Programme
CentralDistributionCentre,Class,Programme,IS-A,,,,,https://www.theworldavatar.com/kg/ontozoning/,Central Distribution Centre
ChildcareCentre,Class,Programme,IS-A,,,,,https://www.theworldavatar.com/kg/ontozoning/,Childcare Centre
Cinema,Class,Programme,IS-A,,,,,https://www.theworldavatar.com/kg/ontozoning/,Cinema
Clinic,Class,Programme,IS-A,,,,,https://www.theworldavatar.com/kg/ontozoning/,Clinic
ClinicalResearchFacility,Class,Programme,IS-A,,,,,https://www.theworldavatar.com/kg/ontozoning/,Clinical Research Facility
